{
  "schema_version": "1.0.0",
  "project_id": "project-001",
  "learner_id": "learner-local",
  "title": "My research question",
  "charter": "Explore how fees can change long-term sample results.",
  "origin": {
    "origin_type": "independent"
  },
  "lifecycle": "active",
  "revision": 1,
  "created_at": "2026-10-16T19:40:00Z",
  "updated_at": "2026-10-16T19:40:00Z"
}
